{
  "schema_version": "asw.evaluation_trial_result.v1",
  "run_id": "asw-mvp-eval-001",
  "trial_id": "trial-001",
  "scenario_id": "job-success",
  "condition": "asw",
  "repetition": 1,
  "status": "completed",
  "ground_truth_transition_ns": 1000000000,
  "recognized_ns": 1050000000,
  "detected": true,
  "missed": false,
  "detection_latency_ms": 50.0,
  "observation_count": 1,
  "duplicate_count": 0,
  "false_positive_count": 0,
  "application_attribution_correct": true,
  "kind_correct": true,
  "subject_correct": true,
  "localization_correct": null,
  "continuation_ready": true,
  "continuation_success": null,
  "continuation_latency_ms": null,
  "agent_tool_calls": null,
  "agent_observation_calls": null,
  "input_tokens": null,
  "output_tokens": null,
  "incorrect_action_count": null,
  "error": null
}
